<!DOCTYPE components PUBLIC
  "-//JBoss/Seam Component Configuration DTD 1.1//EN"
  "http://jboss.com/products/seam/components-1.1.dtd">

<components>
  
    <component name="org.jboss.seam.core.init">
        <property name="debug">true</property>
        <!--
        <property name="jndiPattern">#{ejbName}/local</property>
        -->
    </component>
    
    <component name="org.jboss.seam.core.manager">
        <!-- half second wait for conversation lock on concurrent requests -->
        <property name="concurrentRequestTimeout">500</property>
        <!-- 120 second conversation timeout -->
        <property name="conversationTimeout">120000</property>
        <property name="conversationIdParameter">cid</property>
        <property name="conversationIsLongRunningParameter">clr</property>
    </component>
    
    <component name="org.jboss.seam.core.pages">
        <property name="noConversationViewId">/main.xhtml</property>
    </component>
    
    <component name="bookingDatabase" 
        class="org.jboss.seam.core.EntityManagerFactory"/>
    
    <component name="em"
          class="org.jboss.seam.core.ManagedPersistenceContext">
      <!-- alernative     
      <property name="persistenceUnitJndiName">java:/jpaBookingEntityManagerFactory</property>
      -->
      <property name="entityManagerFactory">#{bookingDatabase}</property>
    </component>

</components>
